{
  "artifact_type": "application_quality_plan",
  "row_ids": [
    "5a8b57f25542995d1e6f1371",
    "5a8c7595554299585d9e36b6",
    "5a85ea095542994775f606a8",
    "5adbf0a255429947ff17385a",
    "5a8e3ea95542995a26add48d",
    "5abd94525542992ac4f382d2",
    "5a85b2d95542997b5ce40028",
    "5a87ab905542996e4f3088c1"
  ],
  "sample_id": "feasibility-eight",
  "schema_version": "1.0",
  "workload_id": "hotpot-distractor-local-v5"
}
